{
  "schemaVersion": "1.0",
  "id": "basic-demo",
  "name": "Basic ClearGuide Demo",
  "domain": "example.com",
  "originUrl": "https://example.com/",
  "steps": [
    {
      "label": "Example heading",
      "selector": "h1",
      "message": "This is the main heading.",
      "urlPattern": "https://example.com/",
      "actionRequired": false
    }
  ]
}
